"","label","text","rule_name","comment_number","proposition_number"
1646,"u","it's a common sense issue that requires the person with the disability to prepare for the isolated emergency by taking proper steps like an epi pen, or an allergy tablet, the same as they would anywhere else, rather than expecting a controlling governmental agency to impose more bans that in effect infringe upon the rights of far more people...","apr",379,4
1647,"u","things have gotten far out of control.","apr",379,5
1648,"n","I know two people exactly like this that have been able to work the system well enough to get such placards when they don't deserve or require them,","apr",379,6
1649,"u","they're in fact lazy.","apr",379,7
1650,"u","At some point, this nonsense has to stop.","apr",379,8
1651,"u","I've long believed that airlines purposely don't announce delays because of the consequences of doing so.","apr",383,0
1652,"n","If a flight is delayed due to weather the airline has no obligation to provide any remedy to the affected passengers.","apr",383,1
1653,"n","Whereas a delay due to a mechanical problem may require compensation or accommodation be made.","apr",383,2
1654,"u","I support an outright ban.","apr",391,0
1655,"u","First, simply as a peanut allergy sufferer, a key travel worry of mine would be allayed.","apr",391,1
1656,"u","Second, either the creation of a buffer-zone or removal of peanuts base on a passenger's request is impractical.","apr",391,2
1657,"u","Finding appropriate seat arrangements for everyone is completely impractical and time-consuming, delaying take-off.","apr",391,3
1658,"u","It also distracts flight attendants from completing their job.","apr",391,4
1659,"u","Second, among all of the other things a passenger needs to be keep in mind when traveling, notifying the airline of a peanut allergy should not be one of them.","apr",391,5
1660,"u","One possible solution is to have a little box checked off when booking a ticket to indicate a peanut allergy.","apr",391,6
1661,"u","But given the myriad of ways in which tickets are booked and purchased today, this is unlikely to be completely successful.","apr",391,7
1662,"u","The most practical solution is to just ban them on flights.","apr",391,8
1663,"u","The decision is not based on the risk to allergy and non-allergy passengers, but the costs of different solutions.","apr",391,9
1664,"u","It seems that so many people on this forum want perfect, cushy, super-convenient, AND inexpensive airline travel.","apr",393,0
1665,"u","Unfortunately, that is IMPOSSIBLE.","apr",393,1
1666,"u","Since airlines have to be competitive AND make a profit for their investors, things will NOT be perfect.","apr",393,2
1667,"n","Also, since people are human,","apr",393,3
1668,"u","there will be errors made by airline personnel.","apr",393,4
1669,"u","Some of these comments just sound like people want to do what they want  but yet get 100% of their fare refunded regardless if the airline is able to sell that seat or not.","apr",393,5
1670,"u","In other words, it sounds like ""to hell with the airlines"".","apr",393,6
1671,"u","Remember, the more regulations government puts on companies, the more prices go up.","apr",393,7
1672,"u","the DOT is just recognizing a product that is being provided by companies that pose a serious threat to a fairly large number of people.","apr",401,0
1673,"n","Most other products aboard flights are considered non-allergenic or do not have particulates that become airborne","apr",401,1
1674,"n","which is the case with the bagged peanuts.","apr",401,2
1675,"u","Also, finding another mode of transportation is not an option for me as I might be the Captain on your flight one day.","apr",401,3
1676,"u","I would think that suggestion is not realistic.","apr",401,4
1677,"u","I understand that for those who do not have that or an allergy it might seem ""overblown""","apr",401,5
1678,"u","but I can assure you that overall, it is not.","apr",401,6
1679,"u","It is simply a desire to eliminate a #1 food allergy product that can become airborne in a small, pressurized aluminum  tube.","apr",401,7
1680,"n","Yes, perfumes and many other products are allergens, most would be classified as irritants and are not life threatening.","apr",402,0
1681,"n","Peanuts are in a unique class of allergen that is quite widespread among the general population that has airborne particulate and that can be life threatening.","apr",402,1
1682,"u","This is about documents risk mitigation for a voluntary product provided by a company.","apr",402,2
1683,"u","You articulated that very, very well.","apr",403,0
1684,"u","Welcome to my world as a severe peanut allergy sufferer and airline Captain.","apr",403,1
1685,"e","I have been dealing with this for over 22 years!","apr",403,2
1686,"u","I am yearning for the day  that I do not have to tell, an incredulous, flight attendant that I need a peanut free zone if I have to travel in the cabin!","apr",403,3
1687,"n","The problem has increased over the years with the advent of more efficient turbofan engines.","apr",404,0
1688,"n","It was found that excessive bleed air extraction from the engines  consumes more fuel than recirculating the air.","apr",404,1
1689,"n","Unlike the ""coal burners"" of the past, modern jets recirculate much more of the air.","apr",404,2
1690,"n","Yes, they go through filters","apr",404,3
1691,"u","but it is quite noticeable when those filters need to be changed, airflow decreases dramatically.","apr",404,4
1692,"n","With airlines scrambling to make money, non safety related items take a back seat and those expensive filters, I believe, are not changed as often.","apr",404,5
1693,"u","Also, your point about the number of people that died aboard a flight is only part of the question.","apr",404,6
1694,"u","Airport Crash Fire and Rescue facilities would be a valuable asset for those statistics as they are the ones to meet a flight if a passenger was ill.","apr",404,7
1695,"n","Yes, most airlines pay flight crew members scheduled flight time or actual time away from the gate whichever is more.","apr",405,0
1696,"n","Eg. if a flight is scheduled for 2 hours ""block to block""  but it takes 3 to fly it, the crew gets 3.","apr",405,1
1697,"n","If the flight leaves that gate and returns 2.5 hours later, most airlines only pay that crew either the 2.0 scheduled  or much less.","apr",405,2
1698,"u","For most crewmembers, the notion that 1 hour at the gate, 2.5 hours of sitting on that taxiway and only get paid for 2 is not very palatable.","apr",405,3
1699,"n","Whereas sitting for 2.5 hours then fly 2 totals 4.5.","apr",405,4
1700,"u","It is mostly the pay structure of pilots or flight attendants that poorly designed.","apr",405,5
1701,"u","Most people would balk at the notion of working 4.5 hours and getting paid for 2.","apr",405,6
1702,"u","I also agree with others who have suggested that if the airline changes your itinerary after you've paid, you should have the right to get a full refund on that trip.","apr",411,0
1703,"u","I think these are appropriate for both foreign and domestic flights, and should be part of the carriers contract of carriage.","apr",411,1
1704,"u","For those arguing that regulating the industry will raise prices, I'd suggest they look at the history of other regulated injuries.","apr",411,2
1705,"u","Often the changes industry have had to implement to comply with government regulations have led to them becoming more efficient organizations.","apr",411,3
1706,"n","And in these cases prices have gone down not up.","apr",411,4
1707,"n","Remember, the airlines are not just carrying cargo, they're transporting human beings.","apr",411,5
1708,"u","And it's important that there be enforceable standards for how these humans are to be treated when in the sky.","apr",411,6
1709,"u","I, for one, am happy to see the end of this ""Wild West"" of the American airline industry.","apr",411,7
1710,"u","You make an excellent point!","apr",412,0
1711,"u","I hope this is also considered by the DOT","apr",412,1
1712,"u","no one expects perfection.","apr",413,0
1713,"u","But the way slots are allotted at airports has created monopolies in many markets.","apr",413,1
1714,"u","So there is, in reality, no ""competition"" which would solve the problems consumers are having in the air.","apr",413,2
1715,"u","Its time for the government to step in and make sure that passengers are treated respectfully and that codes of conduct are standardized across the industry.","apr",413,3
1716,"n","If you look at the history of other industries you'll find that government regulations have not caused prices to rise.","apr",413,4
1717,"n","In fact, regulations have forced these industries to be more efficient and prices have actually dropped.","apr",413,5
1718,"u","So I think this argument is a spurious one.","apr",413,6
1719,"u","The DOT should require posting of occupancy based rates similarly to the posting of one way fares.","apr",414,0
1720,"u","The purchase price quoted should be the purchase price.","apr",414,1
1721,"u","The idea that a consumer could purchase a product and weeks or months later after vacation time has been booked at work and other plans made, the price could be increased is absolutely wrong.","apr",414,2
1722,"u","The only additions to an airfare should be government mandated taxes and fees.","apr",415,0
1723,"u","Surcharges should not be allowed in any case.","apr",415,1
1724,"n","Fuel, for example, is part of the airline's basic cost.","apr",415,2
1725,"u","It should not be an add on to a fare, but part of it.","apr",415,3
1726,"u","If an airline wants to charge more on a certain day, the base fare should include that charge.","apr",415,4
1727,"u","It should never be added on.","apr",415,5
1728,"u","And the proposed rule that the total fare be shown is the only appropriate way to avoid deceptive practices.","apr",415,6
1729,"u","If an airline wishes to inform a customer about the cost of taxes, is should be allowed to list the base fare before taxes in no greater than 1 or 2 the typeface of the total fare along with the total fare.","apr",415,7
1730,"e","I have been allergic to peanuts for nearly 40-years!","apr",419,0
1731,"e","I typically fly Southwest Airlines - a leading airline in distributing peanuts to passengers as THE ONLY SNACK on many of their flights.","apr",419,1
1732,"e","After a typical flight, I will have itchy, watery eyes sometimes to the point where I can barely keep my eyes open.","apr",419,2
1733,"u","Luckily my allergy is not AS BAD as many -","apr",419,3
1734,"u","but I can empathize with those with worse conditions.","apr",419,4
1735,"e","In Southwest's defense, if I would call ahead of time and inform them I was allergic to peanuts they would gladly air out the aircraft and refrain from serving peanuts on my flight.","apr",419,5
1736,"u","Although I am not against the idea of peanuts being restricted from all flights,","apr",419,6
1737,"u","I do appreciate people's comments regarding the absurdity of such an all-encompassing rule.","apr",419,7
1738,"u","I think an effective and simple solution might be to ask passengers either verbally when tickets are purchased person-to-person, or via a question prior to an e-ticket purchase that asks the traveler if they are allergic to peanuts.","apr",419,8
1739,"n","If yes - then that particular flight can be aired out of prior peanuts and peanuts not served on that flight.","apr",419,9
1740,"u","I look forward to seeing the outcome to this issue.","apr",419,10
1741,"u","The notification isn't so much a problem at most airports.","apr",421,0
1742,"n","The electronic boards are usually updated minute by minute.","apr",421,1
1743,"u","The problem is that the airlines will say ""Flight 100, delayed till 7:00pm."" then ""Flight 100, delayed till 7:05pm"".","apr",421,2
1744,"n","And so on and so forth.","apr",421,3
1745,"u","They're notifying everyone...with completely useless information.","apr",421,4
1746,"u","Forcing them to do so more frequently isn't going to fix a thing.","apr",421,5
1747,"u","Forcing them to come up with an accurate estimate is what is needed.","apr",421,6
1748,"u","If you charge for a service , and do not provide that service... then a refund is in order.","apr",422,0
1749,"n","Package services refund based on service actually rendered,","apr",422,1
1750,"u","Two hours is reasonable in most cases.","apr",422,2
1751,"u","It depends on the passenger, and may require more complex itenerary tracking.","apr",422,3
1752,"e","On a flight to Hawaii, my bag was delayed about 4 hours, and delivered to my hotel.","apr",422,4
1753,"u","No big deal.","apr",422,5
1754,"u","If I had been flying somewhere to take a cruise, that could have been a very big deal.","apr",422,6
1755,"n","Some carriers already do this, in certain circumstances.","apr",422,7
1756,"e","I have been able to get refunds from regional carriers for taking a bus.","apr",422,8
1757,"e","It is, however, impossible to get this information from the central reservations number ,","apr",422,9
1758,"u","and the lines at the airport are usually so long that it's almost impossible to talk with anyone FROM the regional carrier to find out if the refund applies.","apr",422,10
1759,"u","Mandating it would simply enforce an already unwritten policy, and provide guidance to the central reservations people about what compensation is due.","apr",422,11
1760,"u","I think it needs to be spelled out.","apr",422,12
1761,"u","Particularly to include refunding frequent-flyer miles.","apr",422,13
1762,"u","At 2 cents a mile, you think they'd be more willing to give those back.","apr",422,14
1763,"n","Some travel sites already have on-time estimates.","apr",422,15
1764,"u","I think all carriers should provide that.","apr",422,16
1765,"u","Maybe a flight is cheap, but never actually takes off.","apr",422,17
1766,"u","What is so special about an international airline.","apr",422,18
1767,"u","Planes are planes, customers are customers.","apr",422,19
1768,"u","Just because you fly between countries doesn't mean that service is more difficult.","apr",422,20
1769,"u","The airline should, of course, only be responsible for the delivery of passenger and bags TO Immigration or Customs.","apr",422,21
1770,"n","If there is a hold in Immigration or Customs, that's a different government department to deal with.","apr",422,22
1771,"u","If the airlines decide to reduce benefits in the contract of carriage, that might actually be a good thing.","apr",422,23
1772,"u","Right now, it's a roll of the dice.","apr",422,24
1773,"n","You HAVE to stand in the 1 hour long service line","apr",422,25
1774,"n","because you MIGHT get a refund, or a few bucks...","apr",422,26
1775,"u","I'd rather know that it wasn't coming, and to give up and get a hotel, than to stand in the line and beg like a puppy for a treat.","apr",422,27
1776,"u","Customers should be able to sue the airline in any appropriate jurisdiction.","apr",422,28
1777,"u","If the airline doesn't have a lawyer in said jurisdiction, I'd hope they can FLY ONE THERE!","apr",422,29
1778,"u","I think all services should be listed.","apr",423,0
1779,"u","Including the real perks like $90 upgrade to first-class domestic.","apr",423,1
1780,"u","For a 'full fare' price, go back to what airlines provided during regulation days, and figure out what ammenities have been removed.","apr",423,2
1781,"u","Then list those.","apr",423,3
1782,"u","All airlines need to comply.","apr",423,4
1783,"n","Restaurants don't go out of business just because they list their prices on the menu.","apr",423,5
1784,"u","I don't think airlines will either.","apr",423,6
1785,"u","There's no truth to what you say about recycled air on planes.","apr",427,0
1786,"n","Contrary to your belief, fresh air is circulated in the cabin from the engine compressors, air conditioned , circulated through louvers, vents and those eyeball graspers above your seat.","apr",427,1
1787,"n","After that, about half is sucked out through the bottom of the fuselage;","apr",427,2
1788,"n","the remainder is run through filters to remove pollutants and particulants and mixed with fresh air again.","apr",427,3
1789,"n","The result is that the air in the cabin is cleaner than most public buildings,","apr",427,4
1790,"n","and it is completely exchanged every 2-3 minutes.","apr",427,5
1791,"u","There's no reason to restrict peanuts on any flight.","apr",429,0
1792,"n","The number of deaths per year due to anaphylaxis  is much, much smaller than other causes of death .","apr",429,1
1793,"u","People who actually suffer from a severe allergic reaction to peanuts know what precautions to take,","apr",429,2
1794,"u","and their condition should never infringe on the rights of others.","apr",429,3
1795,"u","If they can't deal with the risk they take every day, no matter where they are, then they should be living in a bubble.","apr",429,4
1796,"u","Instead of blaming others for their real or perceived allergy, they should take steps to desenstize themselves to peanuts,","apr",429,5
1797,"n","which can be done,","apr",429,6
1798,"n","as studies have shown.","apr",429,7
1799,"n","Even better, North Carolina Agricultural and Technical State University developed a way to remove the allergens from peanuts in 2007,","apr",429,8
1800,"u","so if the various food companies that process and market peanuts take an interest in licensing this technology, people can avoid any fear of allergic reactions from peanuts.","apr",429,9
1801,"n","You can read the press release here:","apr",429,10
1802,"u","You simply have no idea what you're talking about.","apr",430,0
1803,"n","There is no ""diagnosis rate"" of peanut allergies;","apr",430,1
1804,"u","there is a common, misguided belief that peanut allergies are rising and that any reaction to any food is an allergy.","apr",430,2
1805,"n","Unfortunately for you, you actually need to be observed and tested by a licensed, certified doctor for the presence of IgE antibodies to determine if you really have an allergy.","apr",430,3
1806,"u","Furthermore, if you really think that 1 in 100 having a true allergy to peanuts is huge, you're daft.","apr",430,4
1807,"u","That would be 1%, which is 3.3 million people in the U.S.-not a huge number at all.","apr",430,5
1808,"u","Far more people  are allergic to one or more types of dust,","apr",430,6
1809,"u","but you aren't proposing that the FAA should ban dust,","apr",430,7
1810,"n","since that's not possible without shutting down air travel altogether.","apr",430,8
1811,"u","Maybe we should just ban people with peanut allergies from flying;","apr",430,9
1812,"n","that would certainly solve your problem.","apr",430,10
1813,"n","With nearly 2 million peanut allergic people out there","apr",446,0
1814,"n","and the severely allergic classed under ADA protection,","apr",446,1
1815,"u","the airlines should not serve peanuts in any form on any flight.","apr",446,2
1816,"u","I am severely allergic as are my twin sons","apr",446,3
1817,"u","and we cannot fly without specific guarantees from the airline for our safety.","apr",446,4
1818,"n","Sorry, most ""studies"" don't draw any distinction between reported allergies and actual, clinically diagnosed allergies, with the possible exception of the language they use.","apr",449,0
1819,"u","Every one that I've read glosses over such distinctions,","apr",449,1
1820,"u","so you have to read them carefully to see how the ""study"" data was obtained.","apr",449,2
1821,"n","If not, then there's no way to confirm you have an allergy to them.","apr",450,0
1822,"n","You can be intolerant of peanuts,","apr",450,1
1823,"n","but that's not the same thing as an allergy,","apr",450,2
1824,"n","and allergies are not inherited.","apr",450,3
1825,"u","If you're looking for guarantees for safety from an airline or anything else, you're not going to get that, ever.","apr",450,4
1826,"u","You take risks like everyone else no matter what you do.","apr",450,5
1827,"n","And the ADA does not extend any protection to you,","apr",450,6
1828,"n","since allergies are not a disability.","apr",450,7
1829,"n","The courts have consistently ruled against this.","apr",450,8
1830,"n","No, there is no ADA protection for allergy sufferers, nor has there ever been.","apr",451,0
1831,"n","You already tried this argument in the previous comment section.","apr",451,1
1832,"u","If not, then you don't know he has an allergy;","apr",454,0
1833,"n","you have only anecdotal evidence,","apr",454,1
1834,"n","which is often mistaken for true allergies.","apr",454,2
1835,"u","You can fly with your son, you simply choose not to because of your unfounded fear that something will happen;","apr",454,3
1836,"u","that's a choice you made","apr",454,4
1837,"u","and it can't be blamed on the airlines or anyone else.","apr",454,5
1838,"u","You take far greater risks with yourself and your son every day,","apr",454,6
1839,"e","yet somehow you've managed to live this long.","apr",454,7
1840,"u","You're not able to objectively evaluate your risk,","apr",454,8
1841,"u","which is why you fall into the trap of being afraid of things that are very unlikely to happen.","apr",454,9
1842,"n","Far more people die every year from drowning,","apr",454,10
1843,"n","but I don't think that's ever stopped you from going to a pool,","apr",454,11
1844,"u","or that it would stop you from letting your son go swimming in a pool.","apr",454,12
1845,"u","Instead of conflating the remotely possible and the inevitable. step back and look at things objectively;","apr",454,13
1846,"u","when you do, you'll see there are many things that are far more likely to happen than having a severe allergic reaction on a plane.","apr",454,14
1847,"n","Even so, you can desensitize your son","apr",454,15
1848,"u","so that if he has a true peanut allergy now, he won't in the future.","apr",454,16
1849,"n","If not, then you don't know if they have an allergy, or even to what severity.","apr",455,0
1850,"n","As for your claim that she could die if peanuts are ingested in her vicinity, that is utterly false.","apr",455,1
1851,"n","The only way to have any reaction  is to have contact with the offending allergen.","apr",455,2
1852,"u","So anyone else can eat all they like in her vicinity;","apr",455,3
1853,"n","she just has to not come in contact with it.","apr",455,4
1854,"n","Some people die from a severe reaction to peanuts, but not many,","apr",455,5
1855,"n","and I've yet to find a single instance of an airline passenger dying due to anaphylactic shock caused by peanuts.","apr",455,6
1856,"u","You have a responsibility to keep your child safe.","apr",463,0
1857,"n","You don't let them play in traffic","apr",463,1
1858,"n","but we don't ban cars.","apr",463,2
1859,"u","This is no different.","apr",463,3
1860,"u","It is YOUR responsibility, it is not the airline's or the government's job to keep everything away from people that can hurt them","apr",463,4
1861,"u","Whatever you pick, someone out there has a SEVERE allergy to it that can kill them.","apr",463,5
1862,"n","The shampoo ban is supposed to be to prevent liquid explosives from being brought onboard, not to prevent exposure to some allergic to it.","apr",464,0
1863,"n","Sure I can ""survive"" without eating peanuts,","apr",464,1
1864,"n","but you know what, you can also survive without flying wherever it is you are going,","apr",464,2
1865,"n","I think most tarmac delays are either weather related or traffic related.","apr",474,0
1866,"n","At some airports, there are simply so many flights in an out that they can never keep up.","apr",474,1
1867,"u","Or, when the weather is bad, taking off simply isn't viable so flights back up.","apr",474,2
1868,"u","I think the suggestion of having the airlines and airports create ""holding"" areas for delays is very interesting.","apr",474,3
1869,"u","It would be like a remote terminal for planes that had already boarded and left the official gate areas.","apr",474,4
1870,"u","These remote terminals would allow deplaning and have restrooms, emergency and other important facilities.","apr",474,5
1871,"n","Obviously, there are logistics issues involved,","apr",474,6
1872,"u","but some serious thought about this might pay off.","apr",474,7
1873,"u","There would of course be costs involved,","apr",474,8
1874,"u","but if they're spread across the industry, I can't imagine that the ultimate cost to the consumer would be very much,","apr",474,9
1875,"u","and the availability of such facilities would be a great benefit.","apr",474,10
1876,"u","Such a plan would probably only work at large airports that experience frequent delays,","apr",474,11
1877,"u","so there would need to be a separate set of rules for the smaller airports,","apr",474,12
1878,"u","which couldn't really be expected to build remote terminal facilities.","apr",474,13
1879,"e","I'm a physician, epidemiologist, and mother to a four year old boy with allergies to milk, peanuts and egg.","apr",482,0
1880,"e","My son's dairy allergy is severe,","apr",482,1
1881,"e","and he has had numerous life-threatening anaphylactic reactions to trace amounts of milk,","apr",482,2
1882,"n","which required multiple doses of epinephrine and trips to the Emergency Department.","apr",482,3
1883,"e","Tests indicate that his peanut allergy is worse,","apr",482,4
1884,"e","but fortunately he has only been exposed once to a peanut;","apr",482,5
1885,"e","he put one in his mouth and had a relatively mild  reaction.","apr",482,6
1886,"e","I've traveled with my children","apr",482,7
1887,"e","and despite calling ahead, making requests, and reminding employees at the door, I've rarely had respect, let alone consistency, in any kind of peanut-free buffer zone or flight.","apr",482,8
1888,"e","Several years ago Continental Airlines customer service headquarters informed me that they would serve peanuts on all flights","apr",482,9
