"","label","text","rule_name","comment_number","proposition_number"
0,"u","DOT's objective in setting this rule should be to ELIMINATE all bumping, not merely achieve some  reduction.","apr",522,0
1,"u","Regardless of how many caveats an airline might state in its contract terms, passengers neither want nor deserve a ticket for an oversold seat.","apr",522,1
2,"u","Bumping is a purely economic device that treats passengers as economic units devoid of humanity, like so many other aspects of airline behavior.","apr",522,2
3,"u","From that objective, it follows that there should be NO cap on compensation and that the financial penalty to the airline should be strong enough to prevent bumping, not just keep it at some arbitrarily ""acceptable"" level.","apr",522,3
4,"u","The 100% of the total ticket price for expected arrival within 2 hours later is reasonable.","apr",522,4
5,"u","Compensation for a longer delay should be the GREATER of 200% of the total ticket cost or the passenger's demonstrable out-of-pocket costs resulting from the delay  including any higher priced air ticket from the same or another carrier at the same class, and lodging, meals and incidentals at average prevailing prices in that metro area, and  with the obligation on the passenger to minimize those costs by arranging, with good faith help from the airline, an alternate flight or other means to get him or her to the destination as soon as reasonably practical.","apr",522,5
6,"u","I strongly support cash compensation for bumping passengers with zero-price tickets, e.g., those from frequent-flier programs.","apr",523,0
7,"u","But to assure adequate compensation and prevent airlines gaming such a requirement, compensation should be at the average  ticket price for that service class on that flight.","apr",523,1
8,"u","DOT's proposed rule using the lowest fare ticket would encourage airlines to bump those with zero-price tickets first,","apr",523,2
9,"u","since that cost would be lowest.","apr",523,3
10,"u","As long as they continue to offer tickets for miles, airlines should not be encouraged to treat passengers using those tickets as second-class when it comes to bumping.","apr",523,4
11,"u","The growing scarcity of actual seats for miles -- something that cries out for regulatory intervention -- is bad enough.","apr",523,5
12,"u","The proposals are certainly reasonable and should also be extended to include on-line booking services","apr",32,0
13,"u","since that could be a potential loophole for the airlines not to comply.","apr",32,1
14,"u","There is another growing problem that needs to be addressed, limitation on in-flight sales and solicitation.","apr",33,0
15,"u","One US carrier has mastered this art.","apr",33,1
16,"u","Flight attendants are on the intercom from take-off to landing selling everything from MasterCards to sandwiches.","apr",33,2
17,"e","I boarded USA in Miami in March","apr",33,3
18,"e","and it was the coldest airplance I've ever seen.","apr",33,4
19,"e","Moments later when the lady across the aisle asked for a blanket for her and her young child she was told they had no complimentary ones but could sell her two!","apr",33,5
20,"e","There is NO question in my mind the reason the plane was so cold was to generate blanket sales.","apr",33,6
21,"u","This is just wrong.","apr",33,7
22,"u","What many people who are supporting a ban are forgetting  is if someone has such a severe peanut allergy that a reaction occurs when breathing or touching something else that has been contaminated , then *all* aircrafts that have ever had peanuts aboard are contaminated.","apr",613,0
23,"n","Banning future peanuts doesn't change that cross-contamination is already in place and it's already a life-threatening environment.","apr",613,1
24,"u","Not feasible.","apr",613,2
25,"e","I, too, suffer from a life-threatening food allergy;","apr",613,3
26,"u","but I do not expect the world to change for me.","apr",613,4
27,"e","I adjust to the world;","apr",613,5
28,"e","if I think there's a chance that I will be exposed to my food ""poison, I don't go there.","apr",613,6
29,"u","It's inconvenient and sometimes a hardship for me,","apr",613,7
30,"e","but I'm the one with the allergy.","apr",613,8
31,"u","Unfortunately, there are no guarantees in this world.","apr",613,9
32,"u","Probably.","apr",613,10
33,"u","The problem is that banning peanuts alone won't make life on a plane safer;","apr",613,11
34,"u","it'll only be as safe as fellow passengers or airline staff taking precautions for the risk","apr",613,12
35,"u","and, frankly, those who don't have or know anyone who has life-threatening allergies have no idea how easily cross-contamination can occur.","apr",613,13
36,"e","As someone with such an allergy,","apr",613,14
37,"u","there's no way I would place my trust for my life on strangers to take precautions for my allergy.","apr",613,15
38,"u","Banning isn't a real solution; finding a cure is.","apr",613,16
39,"u","It is unfortunate that the airlines have forced the government to step and and set limits by holding passengers hostage on the tarmac and treating them like items to be shipped and not people.","apr",1201,0
40,"u","While schedules must be met -","apr",1201,1
41,"u","EVERYONE is inconvenienced by flight delays, including the airline, the travelers and the airport.","apr",1201,2
42,"u","Consideration is what is needed here,","apr",1201,3
43,"u","and the airlines have proven that they cannot be considerate to the travelers without a rule.","apr",1201,4
44,"u","Consequently, I believe a federal limit is necessary,","apr",1201,5
45,"u","however I believe there are multiple factors that should be considered.","apr",1201,6
46,"u","For instance, if a plane with 100 people on it has only 2 operating bathrooms, perhaps the timeframe should be shorter than a plane with more bathrooms in operation.","apr",1201,7
47,"u","Further, I would think the delay for a smaller plane that provides passengers with so little headroom that they cannot stand up without bending their heads  should be less than 3 hours.","apr",1201,8
48,"u","The facilities on the plane could also be a factor .","apr",1201,9
49,"u","I believe that if the airport is closed  and the bathrooms on the plane are sufficient to satisfy the needs of the travelers, there is no reason to let travelers off the plane if the plane is waiting at the gate.","apr",1201,10
50,"u","However, if the airport is open and the airline does not intend to provide travelers with food, it is appropriate for the airline to let travelers off the plane so they can get food if the wait is long.","apr",1201,11
51,"u","I see the reason for letting travelers deplane as being to allow them to obtain what they need and cannot get if they are held on the plane.","apr",1201,12
52,"u","If international passengers are allowed to disembark, but are unable to access bathrooms or shops to obtain food or reading material, I don't see that as a reasonable accommodation.","apr",1201,13
53,"n","The only reason the airlines do not want to publish their plans in their respective contracts of carriage is because people may attempt to sue them if they fail to comply with those plans.","apr",1201,14
54,"u","Not that I believe people should sue at the drop of a hat,","apr",1201,15
55,"u","but I do believe the travelers should have that as an option if the airline acts in an egregious manner.","apr",1201,16
56,"u","Thus, I believe airlines should be required to include their plans in their contracts of carriage.","apr",1201,17
57,"u","I believe that airports should have tarmac contingency plans.","apr",1201,18
58,"u","Perhaps if both the airlines and the airports were required to have plans, the back and forth would lead to better coordination.","apr",1201,19
59,"u","Throughout all, I believe the airlines should inform their travelers about the situation regularly.","apr",1201,20
60,"u","One reason for traveler angst in these situations is due to the lack of information.","apr",1201,21
61,"u","Setting traveler expectations is good.","apr",1201,22
62,"u","However, airlines also must realize that sometimes the best decision is to let the travelers get off the plane and make other travel arrangements.","apr",1201,23
63,"u","I wholeheartedly agree with the idea that airlines should be required to provide travelers with a full-fare"" price.","apr",1211,0
64,"u","This would allow travelers to compare prices between carriers and make better decisions.","apr",1211,1
65,"u","A good alternative would be to allow an individual to choose what options they will use  and provide an all-in price that includes those options .","apr",1211,2
66,"u","This would allow travelers to determine what the ""all-in"" price includes, but would still allow the traveler to compare apples to apples when determining which airline to travel with.","apr",1211,3
67,"u","ALL carriers that operate in the US should be required to display all-in fares for all flights that either begin or end in the US.","apr",1211,4
68,"u","One result I could see here would be that an airline may allow one checked bag, but the size of the bag may be smaller for some carriers than others - and the charge for oversized bags may be more.","apr",1211,5
69,"u","Oversized bags may be something one doesn't think about until one gets to the airport and then finds out the bag is too big.","apr",1211,6
70,"u","Consequently, it might be good for a more prominent display of requirements on the traveler - e.g., bag size and weight.","apr",1211,7
71,"u","As to ""code share"" price display - as a traveler, I want to know what I am paying and what the restrictions on me would be.","apr",1211,8
72,"u","If there is no cost difference for me to fly on an airline the airline I have contracted with has sub-contracted with to fly me somewhere, I am OK knowing only the all-in price.","apr",1211,9
73,"u","I think, however, that it is important for me, the traveler, to know if the subcontractor has more restrictive luggage requirements that could cause me to need to pay additional fees.","apr",1211,10
74,"u","I believe people want to know about the fees and restrictions when they arrange for travel.","apr",1211,11
75,"u","I'm not sure it is necessary to advertise changes in fees or restrictions.","apr",1211,12
76,"u","Instead, I believe the fees or restrictions should not change for a passenger that has bought his or her ticket.","apr",1211,13
77,"n","The contract between the airline and traveler is set when the ticket is purchased","apr",1211,14
78,"u","and unilateral changes to fees that affect the traveler should not be allowed.","apr",1211,15
79,"u","If that contract allows the airline to change restrictions , the airline should be required to inform affected passengers that have already purchased tickets.","apr",1211,16
80,"u","I think it is terrific that DOT is, based on its experience with customer service plans, setting minimum requirements.","apr",1215,0
81,"u","All of the requirements listed seem reasonable.","apr",1215,1
82,"u","I would not want to fly with an airline that did not do those things.","apr",1215,2
83,"u","With respect to the listed additional standards, I think it is important to note that if a bag is not delivered within 2 hours after the passenger landed on the first leg of a round-trip flight - it could be problematic.","apr",1215,3
84,"u","Whereas if it were delivered that late on the second leg of a round trip and the carrier later delivers it to the traveler's home it may not be such a big deal.","apr",1215,4
85,"u","Similarly, if the round-trip flight is over a long weekend, it is more important for the bag to catch up with the traveler quickly,","apr",1215,5
86,"u","but if the round-trip is over a two week period in one place and the airline delivers the bag to the traveler within a day it may not be as big a deal.","apr",1215,6
87,"u","Refunds for bag fees on lost bags seems appropriate.","apr",1215,7
88,"u","As to fees and taxes, I believe refunds should include any fees and taxes the carrier has not otherwise been required to pay to someone else.","apr",1215,8
89,"u","I also believe carriers should reimburse travelers for lost bags.","apr",1215,9
90,"u","If the carrier fails to deliver a bag on-time, that also should be reimbursed -","apr",1215,10
91,"u","however I believe the definition of ""on time"" could be flexible.","apr",1215,11
92,"u","It is important to carriers to publish on-time performance.","apr",1218,0
93,"u","This is an important statistic used by some travelers to make choices about the carriers they wish to fly with.","apr",1218,1
94,"u","Also, the requirement to publish these statistics makes the carriers pay more attention to their achievements both individually and as compared to other carriers.","apr",1218,2
95,"e","I have a peanut allergy and do not fly on airplanes very often.","apr",678,0
96,"e","However, my husband and I took a trip that required flying for travel","apr",678,1
97,"u","and I was very worried about the peanuts.","apr",678,2
98,"e","I took over-the-counter medicine to prevent a reaction and was very careful during the trip.","apr",678,3
99,"u","I can be as careful as I need to be,","apr",678,4
100,"n","but I can't help what the people around me eat.","apr",678,5
101,"u","I think that the two best ideas are banning nuts  from all flights, or having nut-free flights available .","apr",678,6
102,"u","When discussing an epinephrine auto-injector, I feel there should be one on the plane as part of the medical equipment, but should only be used in an emergency situation.","apr",678,7
103,"e","My doctor to me that if I use the Epi Pen, I have a few minutes to get to a hospital so they can regulate the epinephrine that's just been injected into my body.","apr",678,8
104,"e","This advice has caused me not to use the Epi Pen when I know that I can't get to a hospital in a short amount of time.","apr",678,9
105,"u","To me foods items, like a nut crusted chicken and rice dish will not bother me the way peanuts will.","apr",678,10
106,"n","Peanut butter provides the same reaction,","apr",678,11
107,"n","so peanut butter crackers would be out"" with a nut-free ban.","apr",678,12
108,"n","Products containing peanut oil are a different matter.","apr",678,13
109,"e","My doctor explained that the protein that I'm allergic to is broken down in the ""oil"" form,","apr",678,14
110,"u","so foods cooked in peanut oil  do not bother me.","apr",678,15
111,"u","I think there should be no caps on amount airlines have to pay.","apr",1077,0
112,"u","I agree with the proposed required customer service rules.","apr",1079,0
113,"u","Full Prices should be fully disclosed up front,","apr",1080,0
114,"u","and the lowest price available should be disclosed.","apr",1080,1
115,"u","prices should not be increased after purchase.","apr",1080,2
116,"u","DOT should extend the tarmac delay rules to all flights in the US","apr",1081,0
117,"e","On a recent trip from Wa state to Michigan, every single flight  was late by at least a half hour, resulting in missed connections both ways.","apr",855,0
118,"u","When the airport is more than two hours away, notifying passengers of a potential half hour delay won't significantly change whether they head for the airport or not.","apr",855,1
119,"u","However, in retrospect, I would have LOVED to know the following when booking flights: 1 airline's yearly on time percentage; 2 airline's passenger satisfaction rating.","apr",855,2
120,"u","Personally, if I'm going to be treated like cattle, I'd just as soon be happy cattle.","apr",855,3
121,"u","Air travel has turned into such a frustrating exercise  that we look for reasons not to go air.","apr",855,4
122,"u","Frankly, if I have to live with such delays, I'd just as soon do it on a train. THEY are still fun, despite their delays.","apr",855,5
123,"u","anything else whose risks of fatal reaction outweigh the mere convenience of the ignorant, I hope.","apr",254,0
124,"u","ricport, everyone is responsible for themselves AND their effects on others.","apr",257,0
125,"u","Airlines are NOT public spaces. If airlines ban peanuts, MANY passengers WILL bring their own peanuts on board ... as airlines cannot stop people from bringing their own snacks.","apr",677,0
126,"u","I am sympathetic to people with allergies,","apr",677,1
127,"u","but people with allergies need to be prepared with their medicine and then need to stop trying to impose their need on the 99% of the healthy  population.","apr",677,2
128,"u","* 30 minutes is too long;","apr",945,0
129,"n","you say the majority leave within 14 minutes","apr",945,1
130,"u","so set the beginning info as 15 minutes with 30 minute updates unless a resolution is known sooner.","apr",945,2
131,"u","* Specify notification be by all methods available at the airport involved, including ticket agents, with the customer additionally specifying how they are to be notified at home; email, phone, FAX.","apr",945,3
132,"u","* All commercial flights should be included.","apr",945,4
133,"u","* Include the primary reason: bad weather-locally; bad weather-enroute; bad weather at destination; etc.","apr",945,5
134,"u","Don't forget the obvious reasons they don't do better; no enlightened effective regulation; executive compensation; union rules; airport and FAA inefficiencies; monopoly status ; ultimately the bottom line .","apr",946,0
135,"u","Let's look at this logically:","apr",947,0
136,"n","The airline knows when they sell a ticket;","apr",947,1
137,"n","they know when they have sold the full number.","apr",947,2
138,"u","Those passengers should be guaranteed a seat; NO EXCUSES.","apr",947,3
139,"u","Any subsequent tickets sold should be sold as STANDBY with a ranking 1-n, first come; first served!","apr",947,4
140,"u","Problem solved.","apr",947,5
141,"u","If anyone wants to volunteer; use the approach below.","apr",947,6
142,"u","IF YOU DON'T WANT TO USE THE SIMPLE APPROACH!","apr",947,7
143,"u","* First ask for volunteers to receive the next available comparable or better seat on the airline or any other airline, the airline agents to make the arrangements and pay for the seat directly, the passenger to be reimbursed in cash or credit card for their anticipated out of pocket costs due to the delay and their total out of pocket flight costs, tickets, baggage checks, any other fees.","apr",947,8
144,"u","If points were used they would be reinstated with new expiration dates.","apr",947,9
145,"u","*  Do a lottery, no limits, with at least  the results in 1., above, cash or credit cards only;","apr",947,10
146,"u","NO VOUCHERS,","apr",947,11
147,"u","they're almost impossible to use.","apr",947,12
148,"u","* If they still bump someone the sky should be the limit, the results to be appropriate booking plus at least double  the payout in 2., above.","apr",947,13
149,"u","Of course airline lawyers would attempt to make it five pages of weasel words.","apr",947,14
150,"u","Disclosure, disclosure, disclosure!","apr",949,0
151,"u","Not just the ticket price but also the Agent's fee,","apr",952,0
152,"u","which sometimes is considerable.","apr",952,1
153,"u","And Yes! they should not be able to raise the quoted price.","apr",952,2
154,"u","It makes no sense and is misleading to quote a one way price if I have to buy a roundtrip ticket.","apr",954,0
155,"u","If the itemization is Boston to Bombay fare, then various fees, then Bombay to Boston fare and various fees, it is still misleading unless it is specifically preceded by ""Round Trip Required""","apr",954,1
156,"u","If I just want to go from Boston to Bombay and stay there or go  somewhere else, I shouldn't buy this ticket and I should know it ""up front"".","apr",954,2
157,"u","This whole process of additional regulation is brought about because of lack of disclosure by airlines and agents when they unbundle services and initiate obscene fees for them so that we buy tickets and still don't have a deal because we may still be hit by additional fees at checkin.","apr",955,0
158,"u","A DEAL SHOULD BE A DEAL!","apr",955,1
159,"u","Of course not.","apr",955,2
160,"u","I think we should always be talking about airlines, travel agents, and other resellers.","apr",957,0
161,"u","I think the smaller typeface is a bad idea.","apr",957,1
162,"u","Small type is always used for something the purveyor has to say but doesn't want us to be able to read, and we usually can't.","apr",957,2
163,"u","No!  Retroactive pricing is essentially fraud and violates the contract made when money changes hands.","apr",958,0
164,"u","I would favor a rule that disallowed even having a round trip requirement for prices.","apr",958,1
165,"u","If an airline wants to give a credit for roundtrip like stores give case discounts on groceries or such, and listed it as a separate credit in their advertising and on their ticket that might work.","apr",958,2
166,"u","Fares from Boston to New York might vary by time of day and by day of the week","apr",958,3
167,"u","but they should never be based on Round Trip Required.","apr",958,4
168,"u","This is the same as bumping and should be compensated  as such.","apr",959,0
169,"u","See my comments under that category.","apr",959,1
170,"u","It is not just the five hours,","apr",959,2
171,"u","though that is bad enough;","apr",959,3
172,"u","it is all the other inconveniences, arriving late at night, having to cancel engagements, having to call a cab for a long ride vs bus transportation, and a myriad other inconveniences for which the airlines in their hubris currently accepts no responsibility.","apr",959,4
173,"u","The price of fuel doesn't change while I am trying to book a flight.","apr",960,0
174,"u","Maybe airlines should only be allowed to change prices once a week, or once a day, always at midnight, or something like that.","apr",960,1
175,"u","It is extremely frustrating to try to buy a ticket and have availability and or or price change while you are pushing the ""Buy"" button.","apr",960,2
176,"u","Since all these airlines are still split on what services call for fees and how much those services actually cost, they need to create a standard for every airline to use as a basis for quoting prices.","apr",495,0
177,"u","Go back a few years to what was considered ""standard"", and have them quote on: - RT airfare- 1 checked bag- advance seat selection- beverage service- taxes and fees","apr",495,1
178,"u","From there, passengers can unbundle as necessary or add things like premium seating and 2nd or 3rd checked bags .","apr",495,2
179,"u","Rather than encourage airlines to hide all the extra fees, it would instead encourage them to promote their fees -- ""You can save $XXX if you don't check a bag and don't care where you sit!""","apr",495,3
180,"u","* Although perhaps an improvement over current procedures, this will only help a portion of peanut or nut allergic people, and mostly likely won't help severely allergic individuals.","apr",318,0
181,"n","* Airborne peanut or nut proteins can cause anaphylactic reactions faster than surface-bound peanut or nut proteins;","apr",318,1
182,"n","the recycled air in the plane exacerbates this problem.","apr",318,2
183,"n","* Every surface could still be contaminated, even if you wipe down your seats; for example, touching any other arm rest, using lavatory doors, toilets, sinks, and surfaces right after someone else who was eating peanuts or nuts.","apr",318,3
184,"u","* There would simply still be too many risks.","apr",318,4
185,"u","* Again, better than current procedures, and better than a buffer zone, but still a problem.","apr",318,5
186,"n","A peanut or nut allergic individual would likely be walking onto a plane that was not peanut or nut free 30 minutes prior;","apr",318,6
187,"n","and although some cleaning of the cabins occurs between flights,","apr",318,7
188,"n","many of the same issues mentioned above would still exist.","apr",318,8
189,"u","* Most people don't understand and or or are not tolerant of peanut or nut allergy, purely out of lack of knowledge of its severity","apr",318,9
190,"u","prior to having a son diagnosed with peanut or nut and soy allergies I didn't know what it entailed either;","apr",318,10
191,"u","* This has the potential to single out the peanut or nut allergic ""offender"" .","apr",318,11
192,"u","* The only viable solution to make air travel routinely safe for everyone.","apr",318,12
193,"u","* Although there may still be risks of passengers violating the policy,","apr",318,13
194,"n","this resolves all of the issues mentioned above.","apr",318,14
195,"u","The surfaces of and air inside the plane would be safe,","apr",318,15
196,"u","all travelers would know what to expect,","apr",318,16
197,"u","no one would know who was or wasn't peanut or nut allergic.","apr",318,17
198,"u","* Airlines have nothing to lose by instituting a full ban;","apr",318,18
199,"u","they only have customers to gain.","apr",318,19
200,"u","Like with any changes in air travel policy, if such a ban is universally instituted, everyone will have to accept it,","apr",318,20
201,"u","and it will not prevent people from continuing to fly.","apr",318,21
202,"u","However, what will happen is that a large and continuously growing part of the customer market that currently cannot or will not fly, will buy tickets knowing that air travel can be safe.","apr",318,22
203,"u","* Bear in mind the severity of a situation where a peanut or nut allergic individual goes into anaphylactic shock mid-air.","apr",318,23
204,"n","In some cases, Benadryl and an Epipen  will resolve the reaction for an amount of time.","apr",318,24
205,"n","However, in many cases these measures merely buy you enough time to get to an emergency room, typically 10 to 15 minutes;","apr",318,25
206,"u","which would not be possible when in mid-air.","apr",318,26
207,"u","Therefore, while the first two policy options may reduce risk to a degree,","apr",318,27
