"","label","text","rule_name","comment_number","proposition_number"
3297,"e","note that this wa a pprepaid Goventment ticket.","apr",1206,3
3298,"u","I then drow home to wait for my office to open and figure out what happened.","apr",1206,4
3299,"e","Confirmation was made that I had a seat on the fight.","apr",1206,5
3300,"e","By this time I missed my original fight","apr",1206,6
3301,"e","and all flights to my original destinatin were totally full.","apr",1206,7
3302,"e","I was then offered a booking to Las Vegas","apr",1206,8
3303,"e","which I accepted after the base agree to send a car and driver to pick me up in Las Vegas.","apr",1206,9
3304,"e","I confirmed with the airline  that my return trip to California and Corondo","apr",1206,10
3305,"e","On my return, after being driven by base car and drive and requiring the extra expense of a overnight in a hotel, I arrive early the next day and was told that United had changed my ticked to Las Vegas.","apr",1206,11
3306,"e","This time there was room on a later fight for me.","apr",1206,12
3307,"e","End of story is that it cost tax payers' money for the airlines to not accommotate reserved government training.","apr",1206,13
3308,"u","Solution is that USG travelers on businss should have guaranted seats.","apr",1206,14
3309,"u","In addition, I missing my initial trainingg and had to pay for the extra overnight myself.","apr",1206,15
3310,"u","Solution:  airlines should pay for overnights asw the esult of their mistakes.","apr",1206,16
3311,"u","Fortunately this is the worst example I can give..some third world ones are worse!.","apr",1206,17
3312,"u","We can all get by on a pretzel if needed to protect other passengers.","apr",1210,0
3313,"u","Zones are impossible to control as anyone on the overcrowded flights can attest to,","apr",1210,1
3314,"u","and who has not seen children trailed by parents toddling up the aisle a long way from the zone that is their assigned seat.","apr",1210,2
3315,"u","I would rather have the attendants worry about flight safety issues than corralling familes or travelers in zones to enable someone to satisfy a peanut craving during the hour or so they are on the flight.","apr",1210,3
3316,"u","Full, transparent, and clear pricing as part of assisted and on-line sales so people can not purchase a ticket until they have affirmatively rejected or accepted some ot the add-ons.","apr",1212,0
3317,"u","As long a people do not see or do not care to see them the airlines can slip them in after the option to buy from another carrier is past.","apr",1212,1
3318,"u","By forcing the issue up front you can decide at the time of purchase if you want to pay for the services being charged.","apr",1212,2
3319,"u","I believe advertised fares should state the entire price, including fees, taxes, etc.","apr",1220,0
3320,"u","Fares cannot be advertised as one way if the price is only valid with roundtrip fares.","apr",1220,1
3321,"u","These rules should apply to everyone who sells tickets.","apr",1220,2
3322,"u","Post purchase price increases should not be allowed.","apr",1220,3
3323,"u","Optional services should be offered on an opt-in basis.","apr",1220,4
3324,"u","Sad but true, I think airlines will need to have minimum customer service standards dictated to them.","apr",1224,0
3325,"u","Yes to all of the proposed solutions by DOT.","apr",1224,1
3326,"u","TWO hours should be the maximum delay on a tramac.","apr",1225,0
3327,"u","Health issues as well as overuse of restroom facilities before the trip is finally completed are major issues.  Water should always be available to waiting passengars.","apr",1225,1
3328,"u","If the delay is weather related it is out of the carriers control,","apr",1225,2
3329,"u","but IF it is MAINTENANCE related, then all passengars should be given compensation.","apr",1225,3
3330,"u","Without having to pay compensation  the carriers have no incentative to ado their best.","apr",1225,4
3331,"u","Ban peanuts and tree nuts on all flights.","apr",1226,0
3332,"u","I think we are all looking in the wrong direction on this issue.","apr",1227,0
3333,"u","Instead of agonizing over any set of compensation for bumping rules, the solution, with explanation later here, is: NO BUMPING!","apr",1227,1
3334,"u","No bumping could only happen with another solution: NO OVERSELLING!","apr",1227,2
3335,"u","Yes, of course, given certain conditions that could be applied to ALL flights.","apr",1227,3
3336,"u","An airplane flight is no different than any other event, let's say like a concert.","apr",1227,4
3337,"u","Once the concert promoter sells all his seat inventory, he's done.","apr",1227,5
3338,"u","He collects his money and moves on.","apr",1227,6
3339,"u","Same can apply for any air flight.","apr",1227,7
3340,"u","Let the airline sell all his inventory of seats and be done.","apr",1227,8
3341,"u","Let them count their money and move on.","apr",1227,9
3342,"u","Once they buy that ticket, they are also done.","apr",1227,10
3343,"u","In fairness and to offset the airlines' position, at this point the airline would not have to offer up unused ticket credits,","apr",1227,11
3344,"u","they do not have to calculate outrageous ticket change fee's ,","apr",1227,12
3345,"u","they do not have to determine a specific amount of monetary credit to any bumped passenger....","apr",1227,13
3346,"u","there would be none!!!","apr",1227,14
3347,"u","Remember, if you buy that ticket to the concert and don't make it,","apr",1227,15
3348,"u","no concert company is going to give you your money back.","apr",1227,16
3349,"u","But this concept could spawn another business, such as one that would insure you if you miss your flight for other than being bumped reasons.","apr",1227,17
3350,"u","That company could take ALL of the costs involved into consideration  before giving you a premium that would cover the risk.","apr",1227,18
3351,"u","That calculation is available well before the time that any passenger would miss a flight,","apr",1227,19
3352,"u","so there's no last minute figuring that would have to take place.","apr",1227,20
3353,"u","So, that's it.","apr",1227,21
3354,"u","NO OVERBOOKING.","apr",1227,22
3355,"u","NO CREDITS OF ANY KIND FOR MISSING THE FLIGHT.","apr",1227,23
3356,"u","NO MORE PROBLEMS!!","apr",1227,24
3357,"n","The airlines sell mostly non refundable tickets these days,","apr",1229,0
3358,"u","therefore they still get paid for no-shows.","apr",1229,1
3359,"u","I suggest NOT allowing overbooking, but allowing travelers to go to the airport and take a chance on getting a no-show seat at a reduced fare.","apr",1229,2
3360,"u","The airline is still coming out ahead.","apr",1229,3
3361,"u","As a frequent flier, I appreciate the intent of this rule to provide good information to passengers.","apr",1231,0
3362,"u","My carrier of choice, Delta, generally does a good job of this and within the 30 minute time frame suggested so that seems reasonable.","apr",1231,1
3363,"u","I have 3 concerns around these issues....","apr",1231,2
3364,"n","* It is common in a delay situation to have 2 or 3 conflicting pieces of information - one on the airport boards , one on the gate information screen , and then a third version when I call the airline or receive an update text.","apr",1231,3
3365,"u","I'd like the rule to include as much as possible the notion of consistent information.","apr",1231,4
3366,"u","* My second concern is that when a delayed departure or arrival time is provided, the quality of that information can vary greatly.","apr",1231,5
3367,"u","If you're waiting for a plane that's already in the air, the time is probably pretty good.","apr",1231,6
3368,"u","If the plane is still on the ground, that time is generally more subject to change.","apr",1231,7
3369,"u","If you're waiting for crew, you're stuck if not at a hub,","apr",1231,8
3370,"u","but someone else can often be found at a hub so a delayed time may be moved earlier again.","apr",1231,9
3371,"e","On a recent flight, we were delayed about 2 hours on the tarmac.","apr",1232,0
3372,"e","The crew did a good job of keeping us updated every 15 - 20 minutes, if only to say they didn't know anything new.","apr",1232,1
3373,"u","[the issue was weather elsewhere]","apr",1232,2
3374,"u","I was concerned when the pilot announced we would return to the gate if anyone wanted to deplane - losing our place in line, disrupting connections even more, etc.","apr",1232,3
3375,"u","I realize there are medical issues which are emergencies -","apr",1232,4
3376,"u","I'm not talking about those.","apr",1232,5
3377,"u","I agree with the 3 hour rule in principle and think it's reasonable to extend it to more airports and all airlines -","apr",1232,6
3378,"u","I actually think passengers should have less control than we apparently had in this setting.","apr",1232,7
3379,"u","As a frequent traveler, I was not aware I could request compensation in cash or check rather than a travel voucher.","apr",1233,0
3380,"u","While I don't want a lengthy announcement of fine print,","apr",1233,1
3381,"u","basic clarification under sections 5 and 6 here make sense to me.","apr",1233,2
3382,"u","Advertised prices should include all costs, including baggage, etc.","apr",1235,0
3383,"n","A total cost can go down if a passenger is exempt from checked baggage fees or a seat request fee","apr",1235,1
3384,"u","but it may not go up by adding these fees.","apr",1235,2
3385,"u","All charges should be OPT IN, not OPT OUT.","apr",1235,3
3386,"u","Code share fees should be based on the airline from whom I purchased the ticket","apr",1236,0
3387,"u","- if I purchase a DL ticket but one segment is operated by AA ,","apr",1236,1
3388,"u","I should fly under Delta's rules, not American's.","apr",1236,2
3389,"u","A ticket receipt should list any additional charges which might be incurred during the itinerary - seat reservations, baggage, snacks, pillows, etc - with a window to cancel without penalty  after this is presented.","apr",1236,3
3390,"u","All proposals are reasonable and should apply to all carriers and all agencies  who are involved for fees, delay history, etc","apr",1237,0
3391,"u","While I enjoy peanuts and have no allergy,","apr",1238,0
3392,"u","I am severely allergic to dogs and have had asthma attacks when assistance animals or pets are seated near me.","apr",1238,1
3393,"u","I also suffer when those around me have on too much perfume or too strongly scented soap or body products.","apr",1238,2
3394,"u","While I appreciate the seriousness of peanut allergies,","apr",1238,3
3395,"u","if we're going here, let's go here for all allergies.","apr",1238,4
3396,"u","* The tarmac delay limit should apply to all commercial passenger flights.","apr",1239,0
3397,"u","Being stuck on a hot, stinking plane is what is no matter the size of the plane, no matter who owns it.","apr",1239,1
3398,"u","* The tarmac delay rule should apply to airports as well as airlines.","apr",1239,2
3399,"u","* Making the delay interval part of the rules of carriage is less important than making sure excessive tarmac delays don't happen.","apr",1239,3
3400,"u","Both airports and airlines should return delayed planes to the terminal as a matter of course.","apr",1239,4
3401,"u","* Three hours is still too long.","apr",1239,5
3402,"e","As it happens, I have arthritis","apr",1239,6
3403,"u","which is sometimes aggravated when I sit with my knees sharply bent.","apr",1239,7
3404,"u","In three hours I might well be in intense pain","apr",1239,8
3405,"u","so I avoid long flights anyway.","apr",1239,9
3406,"u","If I were writing this rule, I'd say one hour is the maximum permissible delay.","apr",1239,10
3407,"u","Caps should be eliminated.","apr",1242,0
3408,"u","Proposed compensation caps should be equal to no more or less than the normal cost of the ticket plus $100.","apr",1242,1
3409,"u","Passengers bumped any size aircraft should be compensated.","apr",1242,2
3410,"u","There should be no such thing as a zero fare","apr",1242,3
3411,"u","the seat value should be placed at the normal fare or with the same number of frequent flyer miles as was used to book the ticket.","apr",1242,4
3412,"u","The best time for giving passengers information about volunteering should be 10-15 minutes prior to departure.","apr",1242,5
3413,"u","Moderator - The quote illustrates the idea that the DOT should NOT ban peanuts because you are doing exactly the same kind of things the quote covers in an attempt to achieve something for those not willing to take the responsibility themselves.","apr",1246,0
3414,"u","Do NOT ban peanut products unless you are willing to go the VERY many roads of banning other substances as well.","apr",1246,1
3415,"u","Once again, a reaction ""not severe enough to..."".","apr",1247,0
3416,"u","Here is the problem.","apr",1247,1
3417,"n","No one has ever died on an airplane from a peanut allergy.","apr",1247,2
3418,"u","The problem that the DOT is trying to fix here doesn't exist.","apr",1247,3
3419,"n","People have all kinds of allergic reactions in all kinds of places","apr",1247,4
3420,"e","but I don't know of anyone dying from ANY allergic reaction onboard an airplane.","apr",1247,5
3421,"u","Moderator - The problem is if you ban any food product you've just opened the door to ban every food product, perfumes, and an uncountable number of other things.","apr",1248,0
3422,"u","Regulated bans always result in follow-on bans","apr",1248,1
3423,"u","which steadily increase restrictions for problems that are better solved by individual responsibility vice government rules.","apr",1248,2
3424,"u","And that's the REAL problem. ""...let's go here for all allergies.""","apr",1251,0
3425,"u","I've said it before and statements like that just reinforce what I have been saying.","apr",1251,1
3426,"u","Once you ban one thing you will be required to ban a LOT more things going forward.","apr",1251,2
3427,"u","I don't think the DOT is prepared to ban all perfumes, deodorants, service animals, people who smell of smoke, people who use certain shampoo, and on and on and on.","apr",1251,3
3428,"u","I agree with JDwyer.","apr",1252,0
3429,"u","There should be ONE rule  for ALL FLIGHTS -","apr",1252,1
3430,"u","and that should be a maximum of 3 hours with food, water, bathroom available after 2 hours -","apr",1252,2
3431,"u","and airlines should be financially penalized for every passenger on the flight if they disregard the rule -","apr",1252,3
3432,"u","and the penalty should be stiff and evenly applied.","apr",1252,4
3433,"u","Might get their attention and some results.","apr",1252,5
3434,"u","I agree with mthort1 about a baggage carry-on rule that is the same at all US airports and strictly enforced.","apr",1253,0
3435,"u","In addition, these baggage and other fees are ridiculous and need to be regulated.","apr",1253,1
3436,"u","While I agree with charging for more than 1 checked bag under X lb. weight,","apr",1253,2
3437,"u","all other extra fees should be forbidden.","apr",1253,3
3438,"u","If that does not happen, airlines definitely must tell customers when booking what fees are","apr",1253,4
3439,"u","- and they should NEVER include a fee for water or a certain-size carry-on or to use the toilet!!","apr",1253,5
3440,"u","ALL carriers should list ALL separate fees and show the minimum full fare price.","apr",1253,6
3441,"u","Simply put, the total price is the only price that matters.","apr",1254,0
3442,"u","Breaking the price out needlessly confuses the issue.","apr",1254,1
3443,"u","Personally I think that if the airlines are going to charge for checked bags they should EXPECT that passengers will try to get away with the largest carry-on they can get away with.","apr",1264,0
3444,"u","With that in mind they should actually enforce the carry-on size limits BEFORE passengers board.","apr",1264,1
3445,"u","Perhaps establish official size dimensions for carry-ons and make an official ""carry-on"" friendly icon, like TSA did for laptop bags that can go thru scanners without having to take the laptop out.","apr",1264,2
3446,"u","A traveler should be able to know the full price of the ticket with all optional services included as he searches for a flight.","apr",1267,0
3447,"u","This could be accomplished by presenting a list of all optional services on the first reservation page.","apr",1267,1
3448,"u","The traveler would check off the optional services desired and the fares presented for the itinerary would include these so that a reasonable comparison could be made between airlines.","apr",1267,2
3449,"u","I think that 30 minutes would be appropriate for notification.","apr",1268,0
3450,"u","However, my concern would be for how this would work in changing conditions.","apr",1268,1
3451,"u","For example, if a mechanical problem is fixed faster than expected.","apr",1268,2
3452,"u","I agree with some of the others,","apr",1279,0
3453,"u","they should not be telling people they cannot get off the plane.","apr",1279,1
3454,"e","I am tall with back problems,","apr",1279,2
3455,"u","flying is already a pain in the neck,","apr",1279,3
3456,"u","sitting more time on the tarmac just makes matters worse.","apr",1279,4
3457,"u","Their should be a place where passengers are allowed off, but are not allowed to associate with ground crew for security reasons.","apr",1279,5
3458,"u","Being trapped in a plane even for an hour on the ground is not fun,","apr",1279,6
3459,"u","nor is it necessary most of the time.","apr",1279,7
3460,"u","Three hours is way too long!","apr",1279,8
3461,"u","An hour is already difficult.","apr",1279,9
3462,"u","The size of the airport does not matter,","apr",1279,10
3463,"u","as stated before by others, the feeling is the same.","apr",1279,11
3464,"u","The time limit should be no more than 30 minutes.","apr",1279,12
3465,"n","People have health problems or muscle and bone issues cannot stay seated that long.","apr",1279,13
3466,"e","One recent youtube video I saw there was no A or C, no water, could not get up, etc.","apr",1279,14
3467,"u","That is ridiculous.","apr",1279,15
3468,"u","30 minutes! If it is over 30 minutes the plane goes back to the terminal","apr",1279,16
3469,"u","and everyone who wants to get off can,","apr",1279,17
3470,"u","they just have to stay in the confines of the terminal and not to be late to reboard the flight.","apr",1279,18
3471,"u","The airline also needs to stay on top of things and let people know how long they will need to wait at the gate.","apr",1279,19
3472,"u","A flight many years ago, the airline was smart,","apr",1279,20
3473,"u","they told us to wait in the terminal, for 2 more hours due to where we were flying to was too crowded,","apr",1279,21
3474,"u","I was much happier in the terminal than having to sit in the plane for two hours.","apr",1279,22
3475,"u","Kudos to them!","apr",1279,23
3476,"u","* 30 minutes as stated earlier. Period, no excuses.","apr",1279,24
3477,"u","* No, because 30 minutes or back to the gate.","apr",1279,25
3478,"u","* No idea what you mean by this.","apr",1279,26
3479,"n","Either it is or it is not.","apr",1279,27
3480,"u","Put everyone in a separate place that they cannot leave the terminal or gate area,","apr",1279,28
3481,"u","it is not that difficult,","apr",1279,29
3482,"u","it is not rocket science here..","apr",1279,30
3483,"u","Passengers should be allowed off anytime with out anyone having to tell us we can, period.","apr",1279,31
3484,"u","We should not be mandated to sit for hours and hours.","apr",1279,32
3485,"u","All airports should have places for this,","apr",1279,33
3486,"u","go back to the gate","apr",1279,34
3487,"u","and let us get off and wait in the terminal at the gate so that security is not compromised.","apr",1279,35
3488,"u","Whatever protects us is ok with me.","apr",1281,0
3489,"u","I just don't want more fees added for whatever the changes are.","apr",1281,1
3490,"e","I fly international a lot,","apr",1281,2
3491,"u","and I am not really sure what you are asking of us..","apr",1281,3
3492,"u","All fees should be shown on the initial screen showing a price or in any ad showing a fare.","apr",1292,0
3493,"u","That said, I would prefer the rule to be that airlines return to the standard of several years ago.","apr",1292,1
3494,"u","Any flight to, from or within the US includes 2 bags of up to 70lb. and a carry on in the standard 22 inch size.","apr",1292,2
3495,"u","My worst experiences with notifications have been ""after hours"" at some airports,","apr",1293,0
3496,"u","when most of the staffs have left and nobody seems to be minding the store.","apr",1293,1
3497,"e","I arrive to pick up someone from a flight and cannot even get info on the status boards by the gates or security.","apr",1293,2
3498,"u","So, yes, I think airlines should keep up their end of the deal until all their flights are FINISHED for the day!","apr",1293,3
3499,"u","If flights are late coming or going, airline staff need to stay with it.","apr",1293,4
3500,"u","I find it interesting that the moderator keeps saying the DOT will consider carry on rules in the future.","apr",1294,0
3501,"n","The fact is there ARE current carry on rules in effect.","apr",1294,1
3502,"n","Sadly the CURRENT carry on rules ARE NOT ENFORCED!","apr",1294,2
3503,"u","A great start would be to ENFORCE the current rules.","apr",1294,3
3504,"u","This needs to happen AT THE SECURITY CHECKPOINT,","apr",1294,4
3505,"u","so that those who need to check luggage are easily directed back to the airline's ticket counter.","apr",1294,5
3506,"u","As far as the multiple, and seemingly never ending array of fees that the airlines are charging, yes, these fees should be prominently displayed as part of the ticket purchase process.","apr",1294,6
3507,"u","The customer should be required to acknowledge their understanding of the fees before the ticket purchase is completed.","apr",1294,7
3508,"u","Perhaps those writing the rules need to check the websites for Ryan Air , EasyJet , or Flybe .","apr",1294,8
3509,"u","As the customer navigates these sites, as part of the ticket purchase process they are asked to select additional items they are interested in.","apr",1294,9
3510,"u","For example, when they select to check a bag, the bottom line price goes up,  same for fees for early boarding, sporting equipment, and the like.","apr",1294,10
3511,"u","The ticket purchase, and the additional fees are then lumped into a single transaction.","apr",1294,11
3512,"u","In this scenario, no advanced notice of changes in the fees would be required, if once the fee is paid, it cannot be changed.","apr",1294,12
3513,"u","Personally, I believe that EVERY airline ticket should include the first checked bag.","apr",1294,13
3514,"u","This would simplify security, and help alleviate the problems with the carry on luggage.","apr",1294,14
3515,"u","I also believe that unless the passenger does not meet the check in time limit for checked luggage, that all fees charged for the transport of that luggage should be immediately refunded to the original form of payment if the luggage does not arrive with the passenger.","apr",1294,15
3516,"u","The regulations, once they are developed should apply to all carriers, no matter size of the plane.","apr",1294,16
3517,"u","No reason to increase the complexity by making exceptions or differences based on the size of the company or size of the plane.","apr",1294,17
3518,"u","The services should cost the same on code share flights, regardless of which carrier is operating the flight.","apr",1294,18
3519,"u","I have sympathy for those with peanut allergies,","apr",219,0
3520,"u","but banning peanuts from flights via a DOT regulation seems to go too far.","apr",219,1
3521,"u","Perhaps advocacy groups for those who are peanut-allergic will approach the major carriers to voluntarily set aside seating blocks that are reserved for allergy sufferers, and non-sufferers who are willing to agree not to eat peanuts while sitting in that particular block.","apr",219,2
3522,"u","As someone who suffers from a medical condition which requires me to carry my ""rescue"" medication with me everywhere I go, I think that if the risk to an allergy sufferer is deemed to be significant, then they should  consider alternate travel methods other than flying,  ensure they have sufficient ""rescue"" medication to last the entire time they might be stuck in an aircraft, and  they should wear appropriate clothing  or  face masks to minimize exposed skin and inhalation risk.","apr",219,3
3523,"u","Requiring other passengers to forgo their ""right"" to eat peanuts so as to accommodate the ""right"" of allergy sufferers to fly seems a bit much, particularly if the allergy sufferers don't fly often, anyway.","apr",219,4
3524,"n","Airlines do not use uniform presentation of taxes and fees, especially fuel surcharges.","apr",139,0
3525,"n","Some airlines break out fuel surcharge when taxes or fees itemization is requested.","apr",139,1
3526,"n","Other airlines include fuel surcharge in basic fare,","apr",139,2
3527,"n","so its amount is concealed.","apr",139,3
3528,"u","All airlines should be required to present fuel surcharge separately, along with other taxes or fees details.","apr",139,4
3529,"u","The itemization should also apply to foreign carriers who fly into the USA.","apr",139,5
3530,"n","Some claim to passengers that they don't know what the itemized taxes or fees are.","apr",139,6
3531,"u","Airlines should be required to clearly distinguish among taxes, government-imposed fees and surcharges.","apr",139,7
3532,"n","Some airlines currently label as ""taxes"" fees and surcharges they themselves impose.","apr",139,8
3533,"u","The airline should compensate passengers who get bumped the full fare it would cost at that particular point of time for the customer to buy a ticket on that airplane.","apr",132,0
3534,"u","Otherwise, airlines will bump passengers who paid a lower fare.","apr",132,1
