"","label","text","rule_name","comment_number","proposition_number"
4741,"u","I can only advise homeowners to have it all in written form and send it by certified mail.","ms",47,7
4742,"u","I don't think homeowners have any benefit by asking questions over the phone .","ms",47,8
4743,"u","When borrowers call in for information or documents, Borrowers should be sent limited access permission to view only their account information and loan documents  in the company document viewer portals,","ms",48,0
4744,"u","borrowers should be permitted to print out all docs found in their loan records.","ms",48,1
4745,"n","This automated process is relatively cost free for the institution and allows the borrowers to gain access to requested docs, and also information pertaining to servicing issues.","ms",48,2
4746,"u","Should the borrower have additional needs beyond this there should be a special link the borrower can intiate in the portal to request additonal information or personal contact from the institution.","ms",48,3
4747,"n","The institution can use this individual posting board to communicate with the borrower, log comments and actions regarding borrowers inquiry.","ms",48,4
4748,"u","This posting board or communication log should be fully accessible by the borrower with complete transparentcy.","ms",48,5
4749,"u","From a technical standpoint, direct access to a loan servicer's web based client portal via a simple username or password is impractical.","ms",49,0
4750,"n","There are many technical settings, VPN's, etc that are set up when vendors access these.","ms",49,1
4751,"n","What they can do, however, is build the code and databases to allow borrowers to access this information via their consumer websites.","ms",49,2
4752,"u","They also need a way for borrowers to be able to submit, review, and update insurance information on these websites.","ms",49,3
4753,"n","Many servicers, such as Bank of America, already have customer service available via chat through their website as well.","ms",49,4
4754,"u","Chat could be an option for customers who are weary of speaking to a representative over the phone and would like a record of the conversation.","ms",49,5
4755,"u","Either way, you have the right idea that these companies need to both upgrade and better utilize their technological capabilities.","ms",49,6
4756,"u","The answers to my QWR were quite surprising.","ms",51,0
4757,"e","The servicer might argue they have too high of costs and burden to reply and that some are ""overly broad"".","ms",51,1
4758,"e","However, the servicer had no problem providing me pages and pages of payoff statement and payment history","ms",51,2
4759,"e","However, even after they wrote me that they checked the reinstatement fees and confirmed those as ""correct"" they cannot itemize even half of them.","ms",51,3
4760,"u","That would take one or two pages to print out and mail - much easier than the information they were willing to provide.","ms",51,4
4761,"u","That request was ""too broad"".","ms",51,5
4762,"u","So yes, the servicer can call too broad what ever they want to.","ms",51,6
4763,"u","I will now write a new QWR asking again for itemization of the fees.","ms",51,7
4764,"u","As a bank they should be able to find out how they themselves came up with that number -","ms",51,8
4765,"n","especially as they have checked them and confirmed in writing that they were correct.","ms",51,9
4766,"u","By the way - the confirmation about the fees being correct came in writing and a copy went to the CFPB.","ms",51,10
4767,"u","I don't believe I would have gotten an answer at all if I had not complained with the CFPB.","ms",51,11
4768,"u","And here is a suggestion for the servicer to cut cost:","ms",51,12
4769,"e","in pre-foreclosure we received a ""Home Transition Guide"" - magazine style and no doubt expensive to print and send that we really didn't care for.","ms",51,13
4770,"e","During the Hamp modification trial we received the same request for our tax returns via Fed Ex over and over again .","ms",51,14
4771,"e","Also, ten days after we reinstated, they send Fed Ex AGAIN with a note that we needed to short sale or give them the deed in lieu of foreclosure.","ms",51,15
4772,"u","One would think they own Fed Ex as much as they use it.","ms",51,16
4773,"u","Some servicers are either completely ineffective with internal communication or they really enjoy throwing money at Fed Ex.","ms",51,17
4774,"u","Also: the proposed clause ""for information it can't get from its records in the ""ordinary course of business"" with ""reasonable efforts"" is downright inviting fraud.","ms",51,18
4775,"u","They need the original promissory note with endorsements or allonge to assign it when the loan is transferred.","ms",51,19
4776,"n","Since the ordinary course of their business has become robo-signing,","ms",51,20
4777,"u","it makes it even easier to deny the request of a copy of the endorsed note.","ms",51,21
4778,"u","this exclusion would give them right to hide fees from their affiliates.","ms",51,22
4779,"u","That could make the game of inflated maintenance fees in foreclosure, force placed insurance, unearned kickback fees, attorney fees a whole new chance.","ms",51,23
4780,"u","If a servicer charges these fees, they should know what they are for and have no problem of disclosing.","ms",51,24
4781,"u","the servicer already successfully denies to answer QWR that can be interpreted as nothing but harassment.","ms",51,25
4782,"u","No I don't.","ms",51,26
4783,"u","My conclusion is that the servicers just don't want to inform the consumers.","ms",51,27
4784,"n","In the year 2012 they can get all the information tied to a borrowers loan with a few strokes on the keyboard.","ms",51,28
4785,"u","Nothing too difficult.","ms",51,29
4786,"u","It is just that some information they DO NOT WANT TO GIVE.","ms",51,30
4787,"u","The CFPB's only role is to protect the consumer.","ms",51,31
4788,"u","They should not even have to worry about making it easier for or less costly for the servicer or the bank.","ms",51,32
4789,"u","My servicer chose to spend money on hiring a high profile law firm only to  answer my QWR entirely.","ms",51,33
4790,"u","Well - that is their choice.","ms",51,34
4791,"u","If the CFPB gives the servicers a pass on not giving information more than a year after a servicing transfer, it is IMPERATIVE that the rules for a full information servicing transfer are solid and enforced.","ms",53,0
4792,"n","That has been addressed in another section,","ms",53,1
4793,"u","Loss of information between 2 banks at no fault to the borrower should never be allowed,","ms",53,2
4794,"n","and it happens all too often in the current environment.","ms",53,3
4795,"n","all of the information is instantaneously available.","ms",53,4
4796,"u","If it's not, it's the bank's fault, not the borrower's.","ms",53,5
4797,"u","It is ""reasonable"" to expect that if you lent me $100,000 that you would be able to tell me absolutely ANYTHING I ask about that $100,000 within a 5 minute phone conversation.","ms",53,6
4798,"u","If anyone needs an illustration, lend me $100,000 in cash right now from 1 private citizen to another.","ms",53,7
4799,"n","You are 1 person,","ms",53,8
4800,"n","and I am 1 person.","ms",53,9
4801,"u","I'm willing to bet I can call you at any time,","ms",53,10
4802,"u","and you will know how much I owe you.","ms",53,11
4803,"u","A professional should always be better than an amateur.","ms",53,12
4804,"u","That's why they're professionals.","ms",53,13
4805,"u","If they're not better, they will be displaced.","ms",53,14
4806,"u","That's how capitalism works.","ms",53,15
4807,"u","If they haven't been displaced, there is corruption in the air.","ms",53,16
4808,"n","For ""overbroad"" and ""unduly burdensome"" information or ""unreasonable volume of documents or information"" I have to point out that there are hundreds of employees at every servicer capable of creating queries that can be implemented and applied quite easily  to pull ANY and ALL loan information for a specific borrower.","ms",53,17
4809,"n","It can all be exported into a spreadsheet, PDF, image file, and more.","ms",53,18
4810,"u","It is a simple process and can be attached to the SQL GUI's utilized by every loan servicer with very minimal effort or cost to the servicer.","ms",53,19
4811,"u","There is absolutely no excuse not to be able to provide any information within 5 minutes.","ms",53,20
4812,"u","It is not a borrower's fault that the banks lost their information,","ms",53,21
4813,"u","and if the situation were reversed, the borrower would not be given  45 days or any types of excuses.","ms",53,22
4814,"u","Use your physical debit card anywhere in the world.","ms",53,23
4815,"u","Sign into your bank account 15 minutes later.","ms",53,24
4816,"u","The charge will show in your account.","ms",53,25
4817,"u","Write a check to pay one of your bills.","ms",53,26
4818,"u","Within 5 business days , an image of that check will be available online.","ms",53,27
4819,"u","It is criminal racketeering,","ms",53,28
4820,"u","and it needs to be stopped,","ms",53,29
4821,"u","and they need to be thoroughly punished for these continued crimes.","ms",53,30
4822,"u","These CFPB rules thus far are a complete joke.","ms",53,31
4823,"u","In contacting a customer, emails and text messages should be allowed,","ms",56,0
4824,"u","but they should be done in conjunction with the 3 phone calls, not in lieu of them.","ms",56,1
4825,"u","For example, if the loan servicer has an email address available, after the 3 phone calls, they should be required to try 3 emails.","ms",56,2
4826,"u","Starting contact efforts 16 days out should be completely fine if a borrower opts in for text messaging.","ms",56,3
4827,"u","A simple text of ""Your mortgage payment is now due. Payment must be received by  to avoid any late fees or collection efforts. If you are unable to make your payment, please contact  at  for alternative options."" text would actually be a great customer service option.","ms",56,4
4828,"u","It may be good to mirror these after Fair Debt Collection practices.","ms",56,5
4829,"u","The servicing systems need to be updated  to ensure that once a borrower accepts a loss mitigation option, these notification options are properly updated.","ms",56,6
4830,"u","For example, there's no need to keep calling someone to say their payment is late if they've already begun the forebearance process,","ms",56,7
4831,"u","the loan term change should update the contact dates, etc.","ms",56,8
4832,"u","Also, if a borrower has a HELOC, 2nd mortgage, or is listed as a co-borrower any other property, they should all be considered together at the time of the initial call.","ms",56,9
4833,"u","These accounts should all be linked so that a borrower facing default on 3 loans for the same property is not overwhelmed, confused, etc.","ms",56,10
4834,"u","The written notice approach seems like it'll work.","ms",57,0
4835,"u","The samples are as clear as they can be.","ms",57,1
4836,"u","Most borrowers won't understand any of it anyway.","ms",57,2
4837,"u","The biggest thing is to ensure they know who they can contact and making sure the c or s reps are fully trained on proper options and disclosures.","ms",57,3
4838,"u","I would definitely recommend that a written notice of confirmation is sent to the borrower for any changes made to their account as well.","ms",57,4
4839,"n","While it may not fully assist them,","ms",57,5
4840,"n","and they may choose to ignore the letters,","ms",57,6
4841,"u","it will help an attorney in discovering useful foreclosure defense information if it gets to that point.","ms",57,7
4842,"u","From a servicer standpoint, it is very simple for a large or small servicer to create letter templates and systematically fill in the appropriate dates, amounts, customer info, etc.","ms",57,8
4843,"n","This technology is built into loan servicing software suites,","ms",57,9
4844,"u","and if a company can't afford loan servicing software, they really have no business servicing loans.","ms",57,10
4845,"u","Just like with banking statements, a borrower should have the option to opt in for paperless.","ms",59,0
4846,"n","If they do, everything can be handled via the web, and email or text notifications can be sent.","ms",59,1
4847,"u","These notifications should contain the exact same information as the paper statement.","ms",59,2
4848,"n","They would just be received earlier","ms",59,3
4849,"n","since there's no physical mail involved.","ms",59,4
4850,"n","Again, since everything can be done electronically,","ms",59,5
4851,"u","there needs to be a way for borrowers to view or update their insurance information electronically through the loan servicer, without having to go to Assurant or QBE's highly deceptive websites.","ms",59,6
4852,"u","If a borrower doesn't want electronic access, that is their choice.","ms",59,7
4853,"n","Servicers such as Wells Fargo, Bank of America, and JPMorgan already have websites set up.","ms",59,8
4854,"u","Adding mortgage or insurance information should not be difficult and should already have been done.","ms",59,9
4855,"u","This addresses nothing in my example.","ms",61,0
4856,"e","They notified me of LMO's but then hid the fact they applied extra risk percentage of 2.5%, meaning the NPV caluculated by my using the HAMP site did not match the NPV value they came up with, since Wells Fargo was adding unbeknown to consumers 2.5% risk to the prime.","ms",61,1
4857,"u","Telling them all the LMO's means nothing if they do not have full disclosures on the numbers used in the NPV model their calculations, and their deteminations.","ms",61,2
4858,"u","They should not be able to disqualify anyone from a LMO unless they fully disclose all the calculations used to determine that disqualification.","ms",61,3
4859,"u","The lender should not be able to place forced insurance and replace the primary titled owner as the beneficiary of any loss policy issued on an pre forclosure asset,","ms",63,0
4860,"u","until forclosure occurs, the DEED is and remains in the ownership under homestead laws of most states, the borrower's legal property.","ms",63,1
4861,"u","I can understand the insurance requirement.","ms",63,2
4862,"u","The borrower should not be required to assume debt, that defies market logic,and then be liable for that debt being issued when they can derive no direct benefit from it, not even policy ownership.","ms",63,3
4863,"u","Also the lender should be required to obtain insurance at prevailing fair market insurance rates the regular consumer pays at the very most,","ms",63,4
4864,"e","when I was forced into REO due to default, and on medical disability, the monthly insurance cost was three times the annual cost of my then existing annual allstate policy cost.","ms",63,5
4865,"e","Which had also had additonal riders including liability umbrellas, for my auto and additional personal medical for visitors, comprehensive platinum content coverage,","ms",63,6
4866,"u","it belies common sense that they be allowed to fleece and abuse already indigent homeowners, like that. Charging 3 times what my full policy costs in a year, in a single month, and not even convering the whole contents of the house.","ms",63,7
4867,"u","They should have to use and provide traditional carrier insurance throught market channels at prevailing fair market insurance rates for the property,","ms",63,8
4868,"u","the policy should be CO-owned with both borrower and lender listed as beneficiaries of any REO policy especially if being billed to the escrow account,","ms",63,9
4869,"u","anything less is the abuse of the fiduciary of escrow.","ms",63,10
4870,"e","I had no problem blindly insuring my house with my current carrier from six states away,","ms",63,11
4871,"e","in fact they knew the number of claims ever filed on the property being insured as well as any claims I had filed on the property I owned prior to this one.","ms",63,12
4872,"u","All of this over inflation claim of excessive risk on REO insurance is a scam designed to insure they overcome the bankruptcy discount on cram downs.","ms",63,13
4873,"u","It prevents qualification for LMO's prevents curing of default as well.","ms",63,14
4874,"u","There is NO reason for it.","ms",63,15
4875,"n","REO and Force-Placed Insurance are 2 different products.","ms",64,0
4876,"u","The REO policy shouldn't have a borrower's name as the beneficiary because it is placed on a property post-foreclosure,","ms",64,1
4877,"u","however, you are 100% correct that these policies should NOT be charged to the borrower's escrow account ,","ms",64,2
4878,"u","and a borrower should NOT be held responsible for any REO charges whatsoever.","ms",64,3
4879,"n","Currently, escrow accounts are systematically added to EVERY foreclosure.","ms",64,4
4880,"n","The point it happens is dependent on the state and whether the lender is FNMA, FMAC, or other.","ms",64,5
4881,"n","These illegally created escrow accounts are illegally saddled with exorbitant MONTHLY REO premiums,","ms",64,6
4882,"n","which end up being charged to the borrower, NOT the lender.","ms",64,7
4883,"u","This is also an example of rampant racketeering and mortgage abuse,","ms",64,8
4884,"u","but it is a separate issue from the Force-Placed premiums falsely placed on mortgages, automobile liens, and other collateral loans.","ms",64,9
4885,"u","No, It doesn't.","ms",65,0
4886,"n","The new industry practice is that loss Mitigation or modifications are to be offered IF it is financially better for the INVESTOR to modify the homeowner instead of foreclosing, a positive net present value.","ms",65,1
4887,"u","But the proposed rules are just a delay for Wall Street to continue business as usual with no regard for fairness or equality, when there were over 5 million modifications issued to avoid the investors fiancial loss when negative equity was involved, setting the new industry practice or legal precedent what is offered in the normal course of business for negative equity homeowners.","ms",65,2
4888,"u","The home was bought and the mortage was invested in under the principles of capitalism,","ms",65,3
4889,"u","we need our governmental agencies to not only recongnize this but to act on it.","ms",65,4
4890,"n","There is no capitalistic financial difference to the homeowner or investor in a foreclosure situation when the property has a loan to value of 135%, 100%, 115% etc..","ms",65,5
4891,"u","The modification being offered is a financial incentive to remain a negative equity homeowner avoiding the investor from taking a financial loss from a foreclosure situation.","ms",65,6
4892,"u","My argument is unless we treated housing as the capitalistic product it is, there will be no recovery.","ms",65,7
4893,"u","What is being proposed is that we continue to allow the ""fox in the hen House"" making their own decisions on who gets a modification or gets foreclosed on based on totally unrevelant factors,","ms",65,8
4894,"u","this is what must be changed.","ms",65,9
4895,"u","All homeowners have a built in reliance because of existing laws that Wall Street would have to act with good faith and fair dealings with them.","ms",65,10
4896,"n","It would be impossible to give a 60 day notice on a rate change,","ms",67,0
4897,"n","when the index you use is supposed to be 45 days prior to the change date, as written in the original note signed by the borrower.","ms",67,1
4898,"u","Strongly support the concept of advanced notice on the ""price shock"".","ms",69,0
4899,"u","It will not however save the consumer from a questionable prior financial decision .","ms",69,1
4900,"u","That is why presenting the critical information upfront, in a standard form single page 10-12point font that emphasizes the reality of the financial agreement they are being presented with, is the real practical force and effect of this rule secrion.","ms",69,2
4901,"e","We received our notice of servicing as outlined here,","ms",73,0
4902,"e","however, the company doing the servicing did not have all the correct information and did not honor the temporary modification outlined by the previous servicer causing us untold hardship and stress.","ms",73,1
4903,"e","Because of their delay in information and application they immediately came after us for charges and late fees that we could not have avoided.","ms",73,2
4904,"u","It was unfair and predatory.","ms",73,3
4905,"e","In addition, our previous lender did not work fairly with us,","ms",73,4
4906,"e","but now that they have sold our loan they no longer have to work with us to correct the flaws in our loan,","ms",73,5
4907,"u","they simply wash their hands","ms",73,6
4908,"u","and the new lender or servicer can truthfully say it was not ""their"" fault.","ms",73,7
4909,"u","This option does not take into account the fraud perpetrated by many lenders.","ms",74,0
4910,"n","While they manipulated LIBOR rates and charged outrageous interest, lying to homebuyers about the loans and ignoring phone calls and pleas for workouts until it was too late to fix the problem.","ms",74,1
4911,"n","The lenders were required to write modifications by our government,","ms",74,2
4912,"n","however it was not legally enforceable","ms",74,3
4913,"n","so they played games with borrowers by dragging out the modification process until the borrower missed a payment or became dismally discouraged or lost a job.","ms",74,4
4914,"n","Many of these lenders are still playing games with the homebuyers and not working with them, but foreclosing with impunity.","ms",74,5
4915,"u","I think that lenders should be forced to include principle write-downs as part of their ""workout"" to prevent foreclosure.","ms",74,6
4916,"u","That principle is an ancient one, Armory v. Delamirie, 1 Strange 505","ms",74,7
4917,"u","The amount of information that is publicly available regarding the fraud that brought us into this place should be enough evidence that the homebuyer should not have to bear this burden alone.","ms",74,8
4918,"u","It is time to get some real relief for the homebuyers","ms",74,9
4919,"u","* currently their are more foreclosed homes than families without homes, and no sign of letting up.","ms",74,10
4920,"u","The consumer cannot continue to carry this fraud alone","ms",74,11
4921,"u","* we did not initiate it.","ms",74,12
4922,"u","The way the statement is broken down is fine .","ms",78,0
4923,"u","What I mean is that even though it's provided on the statement, customer service reps  need to be required to disclose the same information to borrowers.","ms",78,1
4924,"u","In today's day and age of automatic payments and electronic transfers, it's important that ALL lines of communication are treated the same.","ms",78,2
4925,"n","Few people use snail mail,","ms",78,3
4926,"u","and in another 20 years, it'll likely be a thing of the past.","ms",78,4
4927,"u","Many of these regulation seem geared toward the past rather than the technological present and future.","ms",78,5
4928,"u","Transparency is ALWAYS the answer.","ms",78,6
4929,"u","The cost to enter the market or remain in the market shouldn't be a consideration.","ms",83,0
4930,"u","That's all between the investor and the servicers.","ms",83,1
4931,"u","If the investor  want to provide options for smaller servicers, that is up to their discretion.","ms",83,2
4932,"u","If you leave a small servicer exception, it will be used as a loophole for the larger banks to create subsidiaries and exploit these, much like they do with taxes.","ms",83,3
4933,"u","If a company in any industry can't handle the costs of that industry, then they have no business being in that industry.","ms",83,4
4934,"u","If there ends up not being enough servicers to service the loans, then that's something the investors need to look at.","ms",83,5
4935,"u","From my perspective, you're trying to fix the effects rather than the cause.","ms",83,6
4936,"u","The servicers are all about making a buck.","ms",89,0
4937,"u","They need to be held to mortgage modification offers.","ms",89,1
4938,"u","If they lose paperwork, it needs to be on them, NOT the homeowner.","ms",89,2
4939,"u","Modifications should be processed and approved with or without paperwork.","ms",89,3
4940,"e","Yes, and after calling 3 times and sending 3 emails, they must send 3 singing telegrams.","ms",92,0
4941,"u","Let's be realistic here,","ms",92,1
4942,"u","the borrower needs to take some responsibility","ms",92,2
4943,"u","since they should know they are delinquent on their loan.","ms",92,3
4944,"u","I think three phone calls on three separate days is more than a good faith effort.","ms",92,4
4945,"u","If the consumer fails to notify the bank that they changed their phone number, it once again points to the negligence of the consumer.","ms",92,5
4946,"u","These rules are so restrictive that new systems and staff training has to be implemented.","ms",92,6
4947,"u","This is going to drive up the costs and fees associated with getting a mortgage in the first place.","ms",92,7
4948,"u","One phone call or contact of some sort should be more than enough effort on the lender's side.","ms",92,8
4949,"u","The consumer knows they are delinquent and needs to take some responsibility for their actions.","ms",92,9
4950,"u","I agree that a change should be made if the borrower has already negotiated terms so that they aren't repeatedly contacted.","ms",92,10
4951,"u","It would be beneficial to have a proper breakdown of where a mortgage payment is going.","ms",96,0
4952,"e","My current lender puts the information on the statement","ms",96,1
4953,"u","but it is so disorganized that I can't tell what went to interest, escrow, PMI, etc.","ms",96,2
4954,"u","This would be another software change that would require more of an expense to financial institutions.","ms",96,3
4955,"u","The cost of these changes has to be made up in income,","ms",96,4
